<?xml version="1.0" encoding="UTF-8"?>

<!DOCTYPE tvol[
    <!ELEMENT tvol (vol+) >
    <!ELEMENT vol ( depart , arrivee , place , prix )>
        <!ELEMENT depart (aerop,date,heure)>
        <!ELEMENT aerop (#PCDATA)>
        <!ATTLIST aerop id_aerop CDATA #IMPLIED>
        <!ELEMENT date (#PCDATA)>
        <!ELEMENT heure (#PCDATA)>
        <!ELEMENT arrivee (aerop,date,heure)>
        <!ELEMENT place (#PCDATA)>
        <!ELEMENT prix (#PCDATA)>
        <!ATTLIST vol id_vol CDATA #IMPLIED>
]>
<tvol>
    <vol id_vol="2365">
        <depart>
            <aerop id_aerop="CA13689">Casablanca</aerop>
            <date>2019-06-27</date>
            <heure>23:00:00</heure>
            </depart>
        <arrivee>
            <aerop id_aerop="NDR3553">Nador</aerop>
            <date>2019-06-28</date>
            <heure>00:05:00</heure>
        </arrivee>
        <place>5</place>
        <prix>256</prix>
        </vol>
    <vol id_vol="2365">
        <depart>
            <aerop id_aerop="CA13689">Casablanca</aerop>
            <date>2019-06-30</date>
            <heure>23:00:00</heure>
        </depart>
        <arrivee>
            <aerop id_aerop="NDR3553">Nador</aerop>
            <date>2019-07-1</date>
            <heure>00:05:00</heure>
        </arrivee>
        <place>10</place>
        <prix>256</prix>
    </vol>
    <vol id_vol="1574">
        <depart>
            <aerop id_aerop="CA13689">Casablanca</aerop>
            <date>2019-06-28</date>
            <heure>21:00:00</heure>
        </depart>
        <arrivee>
            <aerop id_aerop="NDR3553">Nador</aerop>
            <date>2019-06-28</date>
            <heure>22:05:00</heure>
        </arrivee>
        <place>10</place>
        <prix>256</prix>
    </vol>
    <vol id_vol="3582">
        <depart>
            <aerop id_aerop="CA13689">Casablanca</aerop>
            <date>2019-07-01</date>
            <heure>21:00:00</heure>
        </depart>
        <arrivee>
            <aerop id_aerop="NDR3553">Nador</aerop>
            <date>2019-07-01</date>
            <heure>22:05:00</heure>
        </arrivee>
        <place>5</place>
        <prix>256</prix>
    </vol>
    <vol id_vol="9362">
        <depart>
            <aerop id_aerop="CA13689">Casablanca</aerop>
            <date>2019-07-06</date>
            <heure>23:00:00</heure>
        </depart>
        <arrivee>
            <aerop id_aerop="NDR3553">Nador</aerop>
            <date>2019-07-07</date>
            <heure>00:05:00</heure>
        </arrivee>
        <place>10</place>
        <prix>256</prix>
    </vol>
    <vol id_vol="1183">
        <depart>
            <aerop id_aerop="CA13689">Casablanca</aerop>
            <date>2019-07-10</date>
            <heure>21:00:00</heure>
        </depart>
        <arrivee>
            <aerop id_aerop="NDR3553">Nador</aerop>
            <date>2019-07-10</date>
            <heure>22:05:00</heure>
        </arrivee>
        <place>5</place>
        <prix>256</prix>
    </vol>
    <vol id_vol="4357">
        <depart>
            <aerop id_aerop="CA13689">Casablanca</aerop>
            <date>2019-07-12</date>
            <heure>21:00:00</heure>
        </depart>
        <arrivee>
            <aerop id_aerop="NDR3553">Nador</aerop>
            <date>2019-07-12</date>
            <heure>22:05:00</heure>
        </arrivee>
        <place>5</place>
        <prix>256</prix>
    </vol>
    <vol id_vol="3321">
        <depart>
            <aerop id_aerop="CA13689">Casablanca</aerop>
            <date>2019-07-07</date>
            <heure>21:00:00</heure>
        </depart>
        <arrivee>
            <aerop id_aerop="NDR3553">Nador</aerop>
            <date>2019-07-07</date>
            <heure>22:05:00</heure>
        </arrivee>
        <place>5</place>
        <prix>256</prix>
    </vol>
    <vol id_vol="2214">
        <depart>
            <aerop id_aerop="CA13689">Casablanca</aerop>
            <date>2019-07-04</date>
            <heure>23:00:00</heure>
        </depart>
        <arrivee>
            <aerop id_aerop="NDR3553">Nador</aerop>
            <date>2019-07-05</date>
            <heure>00:05:00</heure>
        </arrivee>
        <place>5</place>
        <prix>256</prix>
    </vol>
    <vol id_vol="1126">
        <depart>
            <aerop id_aerop="NDR3553">Nador</aerop>
            <date>2019-06-26</date>
            <heure>23:00:00</heure>
        </depart>
        <arrivee>
            <aerop id_aerop="CA13689">Casablanca</aerop>
            <date>2019-06-27</date>
            <heure>00:05:00</heure>
        </arrivee>
        <place>5</place>
        <prix>256</prix>
    </vol>
    <vol id_vol="3425">
        <depart>
            <aerop id_aerop="NDR3553">Nador</aerop>
            <date>2019-06-28</date>
            <heure>21:00:00</heure>
        </depart>
        <arrivee>
            <aerop id_aerop="CA13689">Casablanca</aerop>
            <date>2019-06-28</date>
            <heure>22:05:00</heure>
        </arrivee>
        <place>5</place>
        <prix>256</prix>
    </vol>
    <vol id_vol="1754">
        <depart>
            <aerop id_aerop="NDR3553">Nador</aerop>
            <date>2019-07-02</date>
            <heure>06:00:00</heure>
        </depart>
        <arrivee>
            <aerop id_aerop="CA13689">Casablanca</aerop>
            <date>2019-07-02</date>
            <heure>07:05:00</heure>
        </arrivee>
        <place>10</place>
        <prix>256</prix>
    </vol>
    <vol id_vol="9942">
        <depart>
            <aerop id_aerop="NDR3553">Nador</aerop>
            <date>2019-07-03</date>
            <heure>21:00:00</heure>
        </depart>
        <arrivee>
            <aerop id_aerop="CA13689">Casablanca</aerop>
            <date>2019-07-03</date>
            <heure>22:05:00</heure>
        </arrivee>
        <place>5</place>
        <prix>256</prix>
    </vol>
    <vol id_vol="7742">
        <depart>
            <aerop id_aerop="NDR3553">Nador</aerop>
            <date>2019-07-05</date>
            <heure>23:00:00</heure>
        </depart>
        <arrivee>
            <aerop id_aerop="CA13689">Casablanca</aerop>
            <date>2019-07-06</date>
            <heure>00:05:00</heure>
        </arrivee>
        <place>5</place>
        <prix>256</prix>
    </vol>
    <vol id_vol="6652">
        <depart>
            <aerop id_aerop="NDR3553">Nador</aerop>
            <date>2019-07-11</date>
            <heure>21:00:00</heure>
        </depart>
        <arrivee>
            <aerop id_aerop="CA13689">Casablanca</aerop>
            <date>2019-07-11</date>
            <heure>22:05:00</heure>
        </arrivee>
        <place>10</place>
        <prix>256</prix>
    </vol>
    <vol id_vol="9975">
        <depart>
            <aerop id_aerop="NDR3553">Nador</aerop>
            <date>2019-07-13</date>
            <heure>19:00:00</heure>
        </depart>
        <arrivee>
            <aerop id_aerop="CA13689">Casablanca</aerop>
            <date>2019-07-13</date>
            <heure>20:05:00</heure>
        </arrivee>
        <place>5</place>
        <prix>256</prix>
    </vol>
    <vol id_vol="3452">
        <depart>
            <aerop id_aerop="NDR3553">Nador</aerop>
            <date>2019-07-16</date>
            <heure>23:00:00</heure>
        </depart>
        <arrivee>
            <aerop id_aerop="CA13689">Casablanca</aerop>
            <date>2019-07-17</date>
            <heure>00:05:00</heure>
        </arrivee>
        <place>5</place>
        <prix>256</prix>
    </vol>
    <vol id_vol="3458">
        <depart>
            <aerop id_aerop="CA13689">Casablanca</aerop>
            <date>2019-06-29</date>
            <heure>23:05:00</heure>
        </depart>
        <arrivee>
            <aerop id_aerop="DAK6478">Dakhla</aerop>
            <date>2019-06-30</date>
            <heure>01:25:00</heure>
        </arrivee>
        <place>5</place>
        <prix>719</prix>
    </vol>
    <vol id_vol="4455">
        <depart>
            <aerop id_aerop="CA13689">Casablanca</aerop>
            <date>2019-07-01</date>
            <heure>23:25:00</heure>
        </depart>
        <arrivee>
            <aerop id_aerop="DAK6478">Dakhla</aerop>
            <date>2019-07-02</date>
            <heure>01:45:00</heure>
        </arrivee>
        <place>5</place>
        <prix>719</prix>
    </vol>
    <vol id_vol="1239">
        <depart>
            <aerop id_aerop="CA13689">Casablanca</aerop>
            <date>2019-07-04</date>
            <heure>08:05:00</heure>
        </depart>
        <arrivee>
            <aerop id_aerop="DAK6478">Dakhla</aerop>
            <date>2019-07-04</date>
            <heure>10:25:00</heure>
        </arrivee>
        <place>5</place>
        <prix>719</prix>
    </vol>
    <vol id_vol="2460">
        <depart>
            <aerop id_aerop="CA13689">Casablanca</aerop>
            <date>2019-07-09</date>
            <heure>19:35:00</heure>
        </depart>
        <arrivee>
            <aerop id_aerop="DAK6478">Dakhla</aerop>
            <date>2019-07-09</date>
            <heure>21:55:00</heure>
        </arrivee>
        <place>10</place>
        <prix>1074</prix>
    </vol>
    <vol id_vol="9740">
        <depart>
            <aerop id_aerop="CA13689">Casablanca</aerop>
            <date>2019-07-13</date>
            <heure>23:25:00</heure>
        </depart>
        <arrivee>
            <aerop id_aerop="DAK6478">Dakhla</aerop>
            <date>2019-07-14</date>
            <heure>01:45:00</heure>
        </arrivee>
        <place>10</place>
        <prix>1074</prix>
    </vol>
    <vol id_vol="8733">
        <depart>
            <aerop id_aerop="CA13689">Casablanca</aerop>
            <date>2019-07-17</date>
            <heure>13:25:00</heure>
        </depart>
        <arrivee>
            <aerop id_aerop="DAK6478">Dakhla</aerop>
            <date>2019-07-17</date>
            <heure>15:45:00</heure>
        </arrivee>
        <place>5</place>
        <prix>719</prix>
    </vol>
    <vol id_vol="">
        <depart>
            <aerop id_aerop="DAK6478">Dakhla</aerop>
            <date>2019-06-30</date>
            <heure>13:25:00</heure>
        </depart>
        <arrivee>
            <aerop id_aerop="CA13689">Casablanca</aerop>
            <date>2019-06-30</date>
            <heure>15:45:00</heure>
        </arrivee>
        <place>5</place>
        <prix>719</prix>
    </vol>
    <vol id_vol="8840">
        <depart>
            <aerop id_aerop="DAK6478">Dakhla</aerop>
            <date>2019-07-04</date>
            <heure>07:10:00</heure>
        </depart>
        <arrivee>
            <aerop id_aerop="CA13689">Casablanca</aerop>
            <date>2019-07-04</date>
            <heure>09:30:00</heure>
        </arrivee>
        <place>5</place>
        <prix>719</prix>
    </vol>
    <vol id_vol="9520">
        <depart>
            <aerop id_aerop="DAK6478">Dakhla</aerop>
            <date>2019-02-05</date>
            <heure>20:15:00</heure>
        </depart>
        <arrivee>
            <aerop id_aerop="CA13689">Casablanca</aerop>
            <date>2019-02-05</date>
            <heure>22:35:00</heure>
        </arrivee>
        <place>10</place>
        <prix>1074</prix>
    </vol>
    <vol id_vol="8744">
        <depart>
            <aerop id_aerop="DAK6478">Dakhla</aerop>
            <date>2019-07-07</date>
            <heure>13:25:00</heure>
        </depart>
        <arrivee>
            <aerop id_aerop="CA13689">Casablanca</aerop>
            <date>2019-07-07</date>
            <heure>15:45:00</heure>
        </arrivee>
        <place>5</place>
        <prix>719</prix>
    </vol>
    <vol id_vol="8830">
        <depart>
            <aerop id_aerop="DAK6478">Dakhla</aerop>
            <date>2019-07-09</date>
            <heure>07:35:00</heure>
        </depart>
        <arrivee>
            <aerop id_aerop="CA13689">Casablanca</aerop>
            <date>2019-07-09</date>
            <heure>09:55:00</heure>
        </arrivee>
        <place>5</place>
        <prix>719</prix>
    </vol>
    <vol id_vol="9533">
        <depart>
            <aerop id_aerop="DAK6478">Dakhla</aerop>
            <date>2019-07-11</date>
            <heure>20:15:00</heure>
        </depart>
        <arrivee>
            <aerop id_aerop="CA13689">Casablanca</aerop>
            <date>2019-07-11</date>
            <heure>22:35:00</heure>
        </arrivee>
        <place>10</place>
        <prix>1074</prix>
    </vol>
    <vol id_vol="5320">
        <depart>
            <aerop id_aerop="DAK6478">Dakhla</aerop>
            <date>2019-07-13</date>
            <heure>19:35:00</heure>
        </depart>
        <arrivee>
            <aerop id_aerop="CA13689">Casablanca</aerop>
            <date>2019-07-13</date>
            <heure>21:55:00</heure>
        </arrivee>
        <place>10</place>
        <prix>1074</prix>
    </vol>
    <vol id_vol="8770">
        <depart>
            <aerop id_aerop="DAK6478">Dakhla</aerop>
            <date>2019-07-15</date>
            <heure>13:25:00</heure>
        </depart>
        <arrivee>
            <aerop id_aerop="CA13689">Casablanca</aerop>
            <date>2019-07-15</date>
            <heure>15:45:00</heure>
        </arrivee>
        <place>5</place>
        <prix>719</prix>
    </vol>
    <vol id_vol="8699">
        <depart>
            <aerop id_aerop="DAK6478">Dakhla</aerop>
            <date>2019-07-18</date>
            <heure>20:05:00</heure>
        </depart>
        <arrivee>
            <aerop id_aerop="CA13689">Casablanca</aerop>
            <date>2019-07-18</date>
            <heure>22:25:00</heure>
        </arrivee>
        <place>10</place>
        <prix>1074</prix>
    </vol>
    <vol id_vol="9511">
        <depart>
            <aerop id_aerop="DAK6478">Dakhla</aerop>
            <date>2019-07-19</date>
            <heure>07:15:00</heure>
        </depart>
        <arrivee>
            <aerop id_aerop="CA13689">Casablanca</aerop>
            <date>2019-07-19</date>
            <heure>09:35:00</heure>
        </arrivee>
        <place>5</place>
        <prix>719</prix>
    </vol>
    <vol id_vol="7542">
        <depart>
            <aerop id_aerop="CA13689">Casablanca</aerop>
            <date>2019-06-28</date>
            <heure>21:25:00</heure>
        </depart>
        <arrivee>
            <aerop id_aerop="AGO4531">Oujda</aerop>
            <date>2019-06-28</date>
            <heure>22:25:00</heure>
        </arrivee>
        <place>10</place>
        <prix>499</prix>
    </vol>
    <vol id_vol="6789">
        <depart>
            <aerop id_aerop="CA13689">Casablanca</aerop>
            <date>2019-06-30</date>
            <heure>21:25:00</heure>
        </depart>
        <arrivee>
            <aerop id_aerop="AGO4531">Oujda</aerop>
            <date>2019-06-30</date>
            <heure>22:25:00</heure>
        </arrivee>
        <place>10</place>
        <prix>499</prix>
    </vol>
    <vol id_vol="4552">
        <depart>
            <aerop id_aerop="CA13689">Casablanca</aerop>
            <date>2019-07-02</date>
            <heure>21:25:00</heure>
        </depart>
        <arrivee>
            <aerop id_aerop="AGO4531">Oujda</aerop>
            <date>2019-07-02</date>
            <heure>22:25:00</heure>
        </arrivee>
        <place>10</place>
        <prix>499</prix>
    </vol>
    <vol id_vol="1136">
        <depart>
            <aerop id_aerop="CA13689">Casablanca</aerop>
            <date>2019-07-05</date>
            <heure>19:20:00</heure>
        </depart>
        <arrivee>
            <aerop id_aerop="AGO4531">Oujda</aerop>
            <date>2019-07-05</date>
            <heure>20:20:00</heure>
        </arrivee>
        <place>10</place>
        <prix>499</prix>
    </vol>
    <vol id_vol="9531">
        <depart>
            <aerop id_aerop="CA13689">Casablanca</aerop>
            <date>2019-07-06</date>
            <heure>23:45:00</heure>
        </depart>
        <arrivee>
            <aerop id_aerop="AGO4531">Oujda</aerop>
            <date>2019-07-07</date>
            <heure>00:45:00</heure>
        </arrivee>
        <place>10</place>
        <prix>499</prix>
    </vol>
    <vol id_vol="4576">
        <depart>
            <aerop id_aerop="CA13689">Casablanca</aerop>
            <date>2019-07-09</date>
            <heure>20:15:00</heure>
        </depart>
        <arrivee>
            <aerop id_aerop="AGO4531">Oujda</aerop>
            <date>2019-07-09</date>
            <heure>21:15:00</heure>
        </arrivee>
        <place>10</place>
        <prix>499</prix>
    </vol>
    <vol id_vol="5322">
        <depart>
            <aerop id_aerop="CA13689">Casablanca</aerop>
            <date>2019-07-11</date>
            <heure>17:30:00</heure>
        </depart>
        <arrivee>
            <aerop id_aerop="AGO4531">Oujda</aerop>
            <date>2019-07-11</date>
            <heure>18:30:00</heure>
        </arrivee>
        <place>10</place>
        <prix>499</prix>
    </vol>
    <vol id_vol="2356">
        <depart>
            <aerop id_aerop="CA13689">Casablanca</aerop>
            <date>2019-07-12</date>
            <heure>20:05:00</heure>
        </depart>
        <arrivee>
            <aerop id_aerop="AGO4531">Oujda</aerop>
            <date>2019-07-12</date>
            <heure>21:05:00</heure>
        </arrivee>
        <place>10</place>
        <prix>499</prix>
    </vol>
    <vol id_vol="6780">
        <depart>
            <aerop id_aerop="CA13689">Casablanca</aerop>
            <date>2019-06-27</date>
            <heure>10:40:00</heure>
        </depart>
        <arrivee>
            <aerop id_aerop="TNG3324">Tanger</aerop>
            <date>2019-06-27</date>
            <heure>11:35:00</heure>
        </arrivee>
        <place>10</place>
        <prix>1027</prix>
    </vol>
    <vol id_vol="4313">
        <depart>
            <aerop id_aerop="CA13689">Casablanca</aerop>
            <date>2019-06-29</date>
            <heure>05:30:00</heure>
        </depart>
        <arrivee>
            <aerop id_aerop="TNG3324">Tanger</aerop>
            <date>2019-06-29</date>
            <heure></heure>
        </arrivee>
        <place>10</place>
        <prix>1027</prix>
    </vol>
    <vol id_vol="1133">
        <depart>
            <aerop id_aerop="CA13689">Casablanca</aerop>
            <date>2019-07-01</date>
            <heure>09:20:00</heure>
        </depart>
        <arrivee>
            <aerop id_aerop="TNG3324">Tanger</aerop>
            <date>2019-07-01</date>
            <heure>10:25:00</heure>
        </arrivee>
        <place>10</place>
        <prix>1027</prix>
    </vol>
    <vol id_vol="9522">
        <depart>
            <aerop id_aerop="CA13689">Casablanca</aerop>
            <date>2019-07-03</date>
            <heure>10:40:00</heure>
        </depart>
        <arrivee>
            <aerop id_aerop="TNG3324">Tanger</aerop>
            <date>2019-07-03</date>
            <heure>11:35:00</heure>
        </arrivee>
        <place>10</place>
        <prix>619</prix>
    </vol>
    <vol id_vol="4570">
        <depart>
            <aerop id_aerop="CA13689">Casablanca</aerop>
            <date>2019-07-05</date>
            <heure>10:40:00</heure>
        </depart>
        <arrivee>
            <aerop id_aerop="TNG3324">Tanger</aerop>
            <date>2019-07-05</date>
            <heure>11:35:00</heure>
        </arrivee>
        <place>10</place>
        <prix>1027</prix>
    </vol>
    <vol id_vol="4550">
        <depart>
            <aerop id_aerop="CA13689">Casablanca</aerop>
            <date>2019-07-09</date>
            <heure>10:40:00</heure>
        </depart>
        <arrivee>
            <aerop id_aerop="TNG3324">Tanger</aerop>
            <date>2019-07-09</date>
            <heure>11:35:00</heure>
        </arrivee>
        <place>10</place>
        <prix>1027</prix>
    </vol>
    <vol id_vol="2350">
        <depart>
            <aerop id_aerop="CA13689">Casablanca</aerop>
            <date>2019-07-14</date>
            <heure>10:40:00</heure>
        </depart>
        <arrivee>
            <aerop id_aerop="TNG3324">Tanger</aerop>
            <date>2019-07-14</date>
            <heure>11:35:00</heure>
        </arrivee>
        <place>10</place>
        <prix>1027</prix>
    </vol>
    <vol id_vol="9510">
        <depart>
            <aerop id_aerop="CA13689">Casablanca</aerop>
            <date>2019-07-17</date>
            <heure>10:40:00</heure>
        </depart>
        <arrivee>
            <aerop id_aerop="TNG3324">Tanger</aerop>
            <date>2019-07-17</date>
            <heure>11:35:00</heure>
        </arrivee>
        <place>10</place>
        <prix>1027</prix>
    </vol>
    <vol id_vol="7539">
        <depart>
            <aerop id_aerop="TNG3324">Tanger</aerop>
            <date>2019-06-29</date>
            <heure>06:00:00</heure>
        </depart>
        <arrivee>
            <aerop id_aerop="CA13689">Casablanca</aerop>
            <date>2019-06-29</date>
            <heure>07:00:00</heure>
        </arrivee>
        <place>10</place>
        <prix>964</prix>
    </vol>
    <vol id_vol="6790">
        <depart>
            <aerop id_aerop="TNG3324">Tanger</aerop>
            <date>2019-07-02</date>
            <heure>06:00:00</heure>
        </depart>
        <arrivee>
            <aerop id_aerop="CA13689">Casablanca</aerop>
            <date>2019-07-02</date>
            <heure>07:00:00</heure>
        </arrivee>
        <place>10</place>
        <prix>1027</prix>
    </vol>
    <vol id_vol="1113">
        <depart>
            <aerop id_aerop="TNG3324">Tanger</aerop>
            <date>2019-07-06</date>
            <heure>06:00:00</heure>
        </depart>
        <arrivee>
            <aerop id_aerop="CA13689">Casablanca</aerop>
            <date>2019-07-06</date>
            <heure>07:00:00</heure>
        </arrivee>
        <place>10</place>
        <prix>964</prix>
    </vol>
    <vol id_vol="9553">
        <depart>
            <aerop id_aerop="TNG3324">Tanger</aerop>
            <date>2019-07-09</date>
            <heure>06:00:00</heure>
        </depart>
        <arrivee>
            <aerop id_aerop="CA13689">Casablanca</aerop>
            <date>2019-07-09</date>
            <heure>07:00:00</heure>
        </arrivee>
        <place>10</place>
        <prix>964</prix>
    </vol>
    <vol id_vol="4050">
        <depart>
            <aerop id_aerop="TNG3324">Tanger</aerop>
            <date>2019-07-11</date>
            <heure>06:00:00</heure>
        </depart>
        <arrivee>
            <aerop id_aerop="CA13689">Casablanca</aerop>
            <date>2019-07-11</date>
            <heure>07:00:00</heure>
        </arrivee>
        <place>10</place>
        <prix>964</prix>
    </vol>
    <vol id_vol="2330">
        <depart>
            <aerop id_aerop="TNG3324">Tanger</aerop>
            <date>2019-07-13</date>
            <heure>06:00:00</heure>
        </depart>
        <arrivee>
            <aerop id_aerop="CA13689">Casablanca</aerop>
            <date>2019-07-13</date>
            <heure>07:00:00</heure>
        </arrivee>
        <place>10</place>
        <prix>964</prix>
    </vol>
    <vol id_vol="4540">
        <depart>
            <aerop id_aerop="TNG3324">Tanger</aerop>
            <date>2019-07-17</date>
            <heure>06:00:00</heure>
        </depart>
        <arrivee>
            <aerop id_aerop="CA13689">Casablanca</aerop>
            <date>2019-07-19</date>
            <heure>07:00:00</heure>
        </arrivee>
        <place>10</place>
        <prix>964</prix>
    </vol>
    <vol id_vol="9591">
        <depart>
            <aerop id_aerop="TNG3324">Tanger</aerop>
            <date>2019-07-13</date>
            <heure>06:00:00</heure>
        </depart>
        <arrivee>
            <aerop id_aerop="CA13689">Casablanca</aerop>
            <date>2019-07-19</date>
            <heure>07:00:00</heure>
        </arrivee>
        <place>10</place>
        <prix>964</prix>
    </vol>
    <vol id_vol="4111">
        <depart>
            <aerop id_aerop="TNG3324">Tanger</aerop>
            <date>2019-07-15</date>
            <heure>06:00:00</heure>
        </depart>
        <arrivee>
            <aerop id_aerop="CA13689">Casablanca</aerop>
            <date>2019-07-15</date>
            <heure>07:00:00</heure>
        </arrivee>
        <place>10</place>
        <prix>964</prix>
    </vol>
    <vol id_vol="9501">
        <depart>
            <aerop id_aerop="TNG3324">Tanger</aerop>
            <date>2019-07-21</date>
            <heure>06:00:00</heure>
        </depart>
        <arrivee>
            <aerop id_aerop="CA13689">Casablanca</aerop>
            <date>2019-07-21</date>
            <heure>07:00:00</heure>
        </arrivee>
        <place>10</place>
        <prix>964</prix>
    </vol>
    
    
    <vol id_vol="2220">
        <depart>
            <aerop id_aerop="CA13689">Casablanca</aerop>
            <date>2019-06-28</date>
            <heure>10:35:00</heure>
        </depart>
        <arrivee>
            <aerop id_aerop="RAK9468">Marrakech</aerop>
            <date>2019-06-28</date>
            <heure>11:25:00</heure>
        </arrivee>
        <place>5</place>
        <prix>606</prix>
    </vol>
    <vol id_vol="9991">
        <depart>
            <aerop id_aerop="CA13689">Casablanca</aerop>
            <date>2019-06-28</date>
            <heure>04:10:00</heure>
        </depart>
        <arrivee>
            <aerop id_aerop="RAK9468">Marrakech</aerop>
            <date>2019-06-28</date>
            <heure>05:00:00</heure>
        </arrivee>
        <place>10</place>
        <prix>887</prix>
    </vol>
    <vol id_vol="5550">
        <depart>
            <aerop id_aerop="CA13689">Casablanca</aerop>
            <date>2019-06-30</date>
            <heure>10:35:00</heure>
        </depart>
        <arrivee>
            <aerop id_aerop="RAK9468">Marrakech</aerop>
            <date>2019-06-30</date>
            <heure>11:25:00</heure>
        </arrivee>
        <place>5</place>
        <prix>606</prix>
    </vol>
    <vol id_vol="9555">
        <depart>
            <aerop id_aerop="CA13689">Casablanca</aerop>
            <date>2019-06-30</date>
            <heure>04:10:00</heure>
        </depart>
        <arrivee>
            <aerop id_aerop="RAK9468">Marrakech</aerop>
            <date>2019-06-30</date>
            <heure>05:00:00</heure>
        </arrivee>
        <place>10</place>
        <prix>887</prix>
    </vol>
    <vol id_vol="2225">
        <depart>
            <aerop id_aerop="CA13689">Casablanca</aerop>
            <date>2019-07-02</date>
            <heure>10:35:00</heure>
        </depart>
        <arrivee>
            <aerop id_aerop="RAK9468">Marrakech</aerop>
            <date>2019-07-02</date>
            <heure>11:25:00</heure>
        </arrivee>
        <place>5</place>
        <prix>606</prix>
    </vol>
    <vol id_vol="1001">
        <depart>
            <aerop id_aerop="CA13689">Casablanca</aerop>
            <date>2019-07-02</date>
            <heure>04:10:00</heure>
        </depart>
        <arrivee>
            <aerop id_aerop="RAK9468">Marrakech</aerop>
            <date>2019-07-02</date>
            <heure>05:00:00</heure>
        </arrivee>
        <place>10</place>
        <prix>887</prix>
    </vol>
    <vol id_vol="1000">
        <depart>
            <aerop id_aerop="CA13689">Casablanca</aerop>
            <date>2019-07-04</date>
            <heure>10:35:00</heure>
        </depart>
        <arrivee>
            <aerop id_aerop="RAK9468">Marrakech</aerop>
            <date>2019-07-04</date>
            <heure>11:25:00</heure>
        </arrivee>
        <place>5</place>
        <prix>606</prix>
    </vol>
    <vol id_vol="1011">
        <depart>
            <aerop id_aerop="CA13689">Casablanca</aerop>
            <date>2019-06-05</date>
            <heure>04:10:00</heure>
        </depart>
        <arrivee>
            <aerop id_aerop="RAK9468">Marrakech</aerop>
            <date>2019-07-05</date>
            <heure>05:00:00</heure>
        </arrivee>
        <place>10</place>
        <prix>887</prix>
    </vol>
    <vol id_vol="1010">
        <depart>
            <aerop id_aerop="CA13689">Casablanca</aerop>
            <date>2019-07-07</date>
            <heure>10:35:00</heure>
        </depart>
        <arrivee>
            <aerop id_aerop="RAK9468">Marrakech</aerop>
            <date>2019-07-07</date>
            <heure>11:25:00</heure>
        </arrivee>
        <place>5</place>
        <prix>606</prix>
    </vol>
    <vol id_vol="1101">
        <depart>
            <aerop id_aerop="CA13689">Casablanca</aerop>
            <date>2019-07-07</date>
            <heure>04:10:00</heure>
        </depart>
        <arrivee>
            <aerop id_aerop="RAK9468">Marrakech</aerop>
            <date>2019-07-07</date>
            <heure>05:00:00</heure>
        </arrivee>
        <place>10</place>
        <prix>887</prix>
    </vol>
    <vol id_vol="">
        <depart>
            <aerop id_aerop="CA13689">Casablanca</aerop>
            <date>2019-07-07</date>
            <heure>10:35:00</heure>
        </depart>
        <arrivee>
            <aerop id_aerop="RAK9468">Marrakech</aerop>
            <date>2019-07-07</date>
            <heure>11:25:00</heure>
        </arrivee>
        <place>5</place>
        <prix>606</prix>
    </vol>
    <vol id_vol="">
        <depart>
            <aerop id_aerop="CA13689">Casablanca</aerop>
            <date>2019-07-07</date>
            <heure>04:10:00</heure>
        </depart>
        <arrivee>
            <aerop id_aerop="RAK9468">Marrakech</aerop>
            <date>2019-07-07</date>
            <heure>05:00:00</heure>
        </arrivee>
        <place>10</place>
        <prix>887</prix>
    </vol>
    <vol id_vol="1100">
        <depart>
            <aerop id_aerop="AGO4531">Oujda</aerop>
            <date>2019-07-01</date>
            <heure>10:15:00</heure>
        </depart>
        <arrivee>